{
  "intent": "new_trip",
  "patch": {
    "set": {},
    "unset": []
  },
  "refs": [],
  "image": {
    "want": "here",
    "place": {
      "name": "Стамбул",
      "country": "Турция",
      "confidence": 0.95
    },
    "landmark": "Айя-София",
    "traits": {
      "landscape": [
        "old_town"
      ],
      "water": "sea",
      "climate": "temperate",
      "setting": "city",
      "vibe": [
        "culture"
      ]
    }
  },
  "info_question": null,
  "post_purchase": null
}
